{
  "kind": "workflow-report",
  "schema_version": "0.1",
  "example": true,
  "report_id": "RPT-7ef44d9f9d45",
  "workflow": "audit",
  "generated_at": "2026-10-20T21:29:45Z",
  "generator": {
    "name": "archonix",
    "version": "0.1.0"
  },
  "scope": {
    "root": "examples/python-service",
    "mode": "audit",
    "requested_checks": [
      "ruff",
      "bandit",
      "vulture",
      "pytest"
    ]
  },
  "repository": {
    "vcs": "none",
    "revision": null,
    "branch": null,
    "dirty": null,
    "notes": [
      "not a Git repository; no revision recorded"
    ]
  },
  "policy": {
    "permissions": {
      "source_writes": false,
      "artifact_writes": true,
      "repo_code": true,
      "external_tools": true,
      "network": false,
      "dependency_install": false,
      "shared_environment": false,
      "destructive": false
    },
    "sources": {
      "permissions.artifact_writes": "mode:audit",
      "permissions.dependency_install": "mode:audit",
      "permissions.destructive": "mode:audit",
      "permissions.external_tools": "mode:audit",
      "permissions.network": "mode:audit",
      "permissions.repo_code": "command line",
      "permissions.shared_environment": "mode:audit",
      "permissions.source_writes": "mode:audit"
    },
    "ignored_settings": []
  },
  "inventory_summary": {
    "languages": [
      "Python"
    ],
    "ecosystems": [
      "python"
    ],
    "detections": [
      "api-spec: OpenAPI",
      "auth: JWT (PyJWT)",
      "cache: Redis client",
      "container: Docker",
      "database: PostgreSQL client",
      "framework: Flask",
      "lint: Ruff",
      "queue: Celery",
      "test: pytest"
    ]
  },
  "executions": [
    {
      "id": "exec-ruff",
      "check_id": "ruff",
      "tool": "ruff",
      "tool_version": "0.17.1",
      "argv": [
        "ruff",
        "check",
        "--output-format",
        "json",
        "--no-cache",
        "--no-fix",
        "--extend-exclude",
        ".git,.hg,.svn,node_modules,.venv,venv,env,__pycache__,.mypy_cache,.pytest_cache,.ruff_cache,.tox,.nox,.cache,dist,build,.next,.nuxt,.turbo,coverage,htmlcov,.idea,.vscode,target,vendor,.gradle,.terraform,.archonix,*.egg-info",
        "."
      ],
      "cwd": "examples/python-service",
      "started_at": "2026-10-20T21:29:44Z",
      "duration_seconds": 0.038,
      "exit_code": 1,
      "status": "completed",
      "outcome": "findings",
      "outcome_detail": "4 finding(s)",
      "stdout": {
        "excerpt": "[\n  {\n    \"cell\": null,\n    \"code\": \"S105\",\n    \"end_location\": {\n      \"column\": 50,\n      \"row\": 6\n    },\n    \"filename\": \"examples/python-service/app/ops.py\",\n    \"fix\": null,\n    \"location\": {\n      \"column\": 21,\n      \"row\": 6\n    },\n    \"message\": \"Possible hardcoded password assigned to: \\\"DATABASE_PASSWORD\\\"\",\n    \"name\": \"hardcoded-password-string\",\n    \"noqa_row\": 6,\n    \"severity\": \"error\",\n    \"url\": \"https://docs.astral.sh/ruff/rules/hardcoded-password-string\"\n  },\n  {\n    \"cell\": null,\n    \"code\": \"S602\",\n    \"end_location\": {\n      \"column\": 27,\n      \"row\": 11\n    },\n    \"filename\": \"examples/python-service/app/ops.py\",\n    \"fix\": null,\n    \"location\": {\n      \"column\": 12,\n      \"row\": 11\n    },\n    \"message\": \"`subprocess` call with `shell=True` identified, security issue\",\n    \"name\": \"subprocess-popen-with-shell-equals-true\",\n    \"noqa_row\": 11,\n    \"severity\": \"error\",\n    \"url\": \"https://docs.astral.sh/ruff/rules/subprocess-popen-with-shell-equals-true\"\n  },\n  {\n    \"cell\": null,\n    \"code\": \"S101\",\n    \"end_location\": {\n      \"column\": 11,\n      \"row\": 9\n    },\n    \"filename\": \"examples/python-service/tests/test_pricing.py\",\n    \"fix\": null,\n    \"location\": {\n      \"column\": 5,\n      \"row\": 9\n    },\n    \"message\": \"Use of `assert` detected\",\n    \"name\": \"assert\",\n    \"noqa_row\": 9,\n    \"severity\": \"error\",\n    \"url\": \"https://docs.astral.sh/ruff/rules/assert\"\n  },\n  {\n    \"cell\": null,\n    \"code\": \"S101\",\n    \"end_location\": {\n      \"column\": 11,\n      \"row\": 13\n    },\n    \"filename\": \"examples/python-service/tests/test_pricing.py\",\n    \"fix\": null,\n    \"location\": {\n      \"column\": 5,\n      \"row\": 13\n    },\n    \"message\": \"Use of `assert` detected\",\n    \"name\": \"assert\",\n    \"noqa_row\": 13,\n    \"severity\": \"error\",\n    \"url\": \"https://docs.astral.sh/ruff/rules/assert\"\n  }\n]",
        "bytes_total": 2080,
        "truncated": false
      },
      "stderr": {
        "excerpt": null,
        "bytes_total": 0,
        "truncated": false
      },
      "artifacts": [],
      "redaction": {
        "applied": true,
        "replacements": 0
      },
      "test_totals": null,
      "findings_count": 4,
      "parse_limitations": [],
      "requires": {
        "external_tool": true,
        "repo_code": false,
        "network": false,
        "writes_cache": false
      }
    },
    {
      "id": "exec-bandit",
      "check_id": "bandit",
      "tool": "bandit",
      "tool_version": "1.9.4",
      "argv": [
        "bandit",
        "-r",
        ".",
        "-f",
        "json",
        "-q",
        "-x",
        "*/.git/*,*/.hg/*,*/.svn/*,*/node_modules/*,*/.venv/*,*/venv/*,*/env/*,*/__pycache__/*,*/.mypy_cache/*,*/.pytest_cache/*,*/.ruff_cache/*,*/.tox/*,*/.nox/*,*/.cache/*,*/dist/*,*/build/*,*/.next/*,*/.nuxt/*,*/.turbo/*,*/coverage/*,*/htmlcov/*,*/.idea/*,*/.vscode/*,*/target/*,*/vendor/*,*/.gradle/*,*/.terraform/*,*/.archonix/*,*.egg-info"
      ],
      "cwd": "examples/python-service",
      "started_at": "2026-10-20T21:29:44Z",
      "duration_seconds": 0.132,
      "exit_code": 1,
      "status": "completed",
      "outcome": "findings",
      "outcome_detail": "5 finding(s)",
      "stdout": {